先天性股関節脱臼前状態,1348,1348,8000,名詞,固有名詞,一般,*,*,*,先天性股関節脱臼前状態,センテンセイコカンセツダッキュウゼンジョウタイ,センテンセイコカンセツダッキュウゼンジョウタイ,20/21,*,せ[んてんせいこかんせつだ[っきユうぜんじヨう]たい
先天性股関節脱臼治療後亜脱臼,1348,1348,8000,名詞,固有名詞,一般,*,*,*,先天性股関節脱臼治療後亜脱臼,センテンセイコカンセツダッキュウチリョウゴアダッキュウ,センテンセイコカンセツダッキュウチリョウゴアダッキュウ,11/24,*,せ[んてんせいこかんせつだ]っきユうちりヨうごあだ]っき]ユう
先天性股関節脱臼治療後遺残亜脱臼,1348,1348,8000,名詞,固有名詞,一般,*,*,*,先天性股関節脱臼治療後遺残亜脱臼,センテンセイコカンセツダッキュウチリョウゴイザンアダッキュウ,センテンセイコカンセツダッキュウチリョウゴイザンアダッキュウ,11/27,*,せ[んてんせいこかんせつだ]っきユうちりヨうごいざんあだっきユう
先天性縦隔のう胞,1348,1348,8000,名詞,固有名詞,一般,*,*,*,先天性縦隔のう胞,センテンセイジュウカクノウホウ,センテンセイジュウカクノウホウ,12/14,*,せ[んてんせいじユうかくのう]ほう
先天性腎のう胞,1348,1348,8000,名詞,固有名詞,一般,*,*,*,先天性腎のう胞,センテンセイジンノウホウ,センテンセイジンノウホウ,10/12,*,せ[んてんせいじんのう]ほう
先天性膵のう胞,1348,1348,8000,名詞,固有名詞,一般,*,*,*,先天性膵のう胞,センテンセイスイノウホウ,センテンセイスイノウホウ,10/12,*,せ[んてんせいすいのう]ほう
先天性胆のう欠損,1348,1348,8000,名詞,固有名詞,一般,*,*,*,先天性胆のう欠損,センテンセイタンノウケッソン,センテンセイタンノウケッソン,10/14,*,せ[んてんせいたんのうけ]っそん
先天性特発性乳糜腹水,1348,1348,8000,名詞,固有名詞,一般,*,*,*,先天性特発性乳糜腹水,センテンセイトクハツセイニュウビフクスイ,センテンセイトクハツセイニュウビフクスイ,0/19,*,せ[んてんせいとくはつせいにユうびふくすい
先天性ヌック管のう胞,1348,1348,8000,名詞,固有名詞,一般,*,*,*,先天性ヌック管のう胞,センテンセイヌックカンノウホウ,センテンセイヌックカンノウホウ,6/15,*,せ[んてんせいぬ]っくかんのう]ほう
先天性脳のう胞,1348,1348,8000,名詞,固有名詞,一般,*,*,*,先天性脳のう胞,センテンセイノウノウホウ,センテンセイノウノウホウ,10/12,*,せ[んてんせいのうのう]ほう
先天性のう胞性腺腫様形成異常,1348,1348,8000,名詞,固有名詞,一般,*,*,*,先天性のう胞性腺腫様形成異常,センテンセイノウホウセイセンシュヨウケイセイイジョウ,センテンセイノウホウセイセンシュヨウケイセイイジョウ,23/24,*,せ[んてんせいのうほうせいせんしユようけいせいいじ]ヨう
先天性のう胞肺,1348,1348,8000,名詞,固有名詞,一般,*,*,*,先天性のう胞肺,センテンセイノウホウハイ,センテンセイノウホウハイ,10/12,*,せ[んてんせいのうほう]はい
穿頭術及,1348,1348,8000,名詞,固有名詞,一般,*,*,*,穿頭術及,セントウジュツオヨ,セントウジュツオヨ,0/8,*,せ[んとうじユ[つおよ
センナ末,1348,1348,8000,名詞,固有名詞,一般,*,*,*,センナ末,センナマツ,センナマツ,3/5,*,せ[んな]まつ
センナ末鈴,1348,1348,8000,名詞,固有名詞,一般,*,*,*,センナ末鈴,センナマツスズ,センナマツスズ,5/7,*,せ[んなまつ]すず
センナリド錠,1348,1348,8000,名詞,固有名詞,一般,*,*,*,センナリド錠,センナリドジョウ,センナリドジョウ,7/7,*,せ[んなりど[じ]ヨう
センナル錠,1348,1348,8000,名詞,固有名詞,一般,*,*,*,センナル錠,センナルジョウ,センナルジョウ,4/6,*,せ[んなるじ]ヨう
センノサイド錠,1348,1348,8000,名詞,固有名詞,一般,*,*,*,センノサイド錠,センノサイドジョウ,センノサイドジョウ,8/8,*,せ[んのさいど[じ]ヨう
センノサイド内用液,1348,1348,8000,名詞,固有名詞,一般,*,*,*,センノサイド内用液,センノサイドナイヨウエキ,センノサイドナイヨウエキ,10/12,*,せ[んのさいどないよう]えき
センノシド錠,1348,1348,8000,名詞,固有名詞,一般,*,*,*,センノシド錠,センノシドジョウ,センノシドジョウ,7/7,*,せ[んのしど[じ]ヨう
センブリ・重曹散鈴,1348,1348,8000,名詞,固有名詞,一般,*,*,*,センブリ・重曹散鈴,センブリジュウソウサンスズ,センブリジュウソウサンスズ,10/12,*,せ[んぶりじユうそうさん]すず
センブリ末Ｎ,1348,1348,8000,名詞,固有名詞,一般,*,*,*,センブリ末Ｎ,センブリマツ,センブリマツ,4/6,*,せ[んぶり]まつ
センブリ末Ｎ,1348,1348,8000,名詞,固有名詞,一般,*,*,*,センブリ末Ｎ,センブリマツエヌ,センブリマツエヌ,6/8,*,せ[んぶりまつ]えぬ
センブリ末鈴,1348,1348,8000,名詞,固有名詞,一般,*,*,*,センブリ末鈴,センブリマツスズ,センブリマツスズ,7/8,*,せ[んぶりま[つ]すず
専門医氏名：,1348,1348,8000,名詞,固有名詞,一般,*,*,*,専門医氏名：,センモンイシメイ,センモンイシメイ,6/8,*,せ[んもんいし]めい
専門病院準,1348,1348,8000,名詞,固有名詞,一般,*,*,*,専門病院準,センモンビョウインジュン,センモンビョウインジュン,9/10,*,せ[んもんびヨういんじ]ユん
脆弱Ｘ症候群,1348,1348,8000,名詞,固有名詞,一般,*,*,*,脆弱Ｘ症候群,ゼイジャクエックスショウコウグン,ゼイジャクエックスショウコウグン,5/14,*,ぜ[いじヤくえ]っくすしヨうこう]ぐん
ゼオチン錠,1348,1348,8000,名詞,固有名詞,一般,*,*,*,ゼオチン錠,ゼオチンジョウ,ゼオチンジョウ,4/6,*,ぜ[おちんじ]ヨう
ゼストリル錠,1348,1348,8000,名詞,固有名詞,一般,*,*,*,ゼストリル錠,ゼストリルジョウ,ゼストリルジョウ,5/7,*,ぜ[すとりるじ]ヨう
ゼストロミン錠,1348,1348,8000,名詞,固有名詞,一般,*,*,*,ゼストロミン錠,ゼストロミンジョウ,ゼストロミンジョウ,6/8,*,ぜ[すとろみんじ]ヨう
ゼスラン錠,1348,1348,8000,名詞,固有名詞,一般,*,*,*,ゼスラン錠,ゼスランジョウ,ゼスランジョウ,4/6,*,ぜ[すらんじ]ヨう
ゼスン錠,1348,1348,8000,名詞,固有名詞,一般,*,*,*,ゼスン錠,ゼスンジョウ,ゼスンジョウ,3/5,*,ぜ[すんじ]ヨう
舌下錠,1348,1348,8000,名詞,固有名詞,一般,*,*,*,舌下錠,ゼッカジョウ,ゼッカジョウ,3/5,*,ぜ[っかじ]ヨう
ゼットブリン点滴静注液,1348,1348,8000,名詞,固有名詞,一般,*,*,*,ゼットブリン点滴静注液,ゼットブリンテンテキジョウチュウエキ,ゼットブリンテンテキジョウチュウエキ,13/16,*,ぜ[っとぶりんてんてきじヨうちユう]えき
舌粘液のう胞,1348,1348,8000,名詞,固有名詞,一般,*,*,*,舌粘液のう胞,ゼツネンエキノウホウ,ゼツネンエキノウホウ,8/10,*,ぜ[つねんえきのう]ほう
ゼフィックス錠,1348,1348,8000,名詞,固有名詞,一般,*,*,*,ゼフィックス錠,ゼフィックスジョウ,ゼフィックスジョウ,6/7,*,ぜ[ふイっくす[じ]ヨう
ゼプリオン水懸筋注,1348,1348,8000,名詞,固有名詞,一般,*,*,*,ゼプリオン水懸筋注,ゼプリオンスイケンキンチュウ,ゼプリオンスイケンキンチュウ,11/13,*,ぜ[ぷりおんすいけんきんち]ユう
ゼリットカプセル,1348,1348,8000,名詞,固有名詞,一般,*,*,*,ゼリットカプセル,ゼリットカプセル,ゼリットカプセル,1/8,*,ぜ[り]っとか[ぷ]せる
ゼルヤンツ錠,1348,1348,8000,名詞,固有名詞,一般,*,*,*,ゼルヤンツ錠,ゼルヤンツジョウ,ゼルヤンツジョウ,7/7,*,ぜ[るやんつ[じ]ヨう
ゼンアスピリン錠,1348,1348,8000,名詞,固有名詞,一般,*,*,*,ゼンアスピリン錠,ゼンアスピリンジョウ,ゼンアスピリンジョウ,7/9,*,ぜ[んあすぴりんじ]ヨう
前期通院対象者通院医学管理料,1348,1348,8000,名詞,固有名詞,一般,*,*,*,前期通院対象者通院医学管理料,ゼンキツウインタイショウシャツウインイ,ゼンキツウインタイショウシャツウインイ,15/17,*,ぜ[んきつういんたいしヨうしヤつうい]んい
前装金属冠過高,1348,1348,8000,名詞,固有名詞,一般,*,*,*,前装金属冠過高,ゼンソウキンゾクカンカコウ,ゼンソウキンゾクカンカコウ,11/13,*,ぜ[んそうきんぞくかんか]こう
前装金属冠前装部脱離,1348,1348,8000,名詞,固有名詞,一般,*,*,*,前装金属冠前装部脱離,ゼンソウキンゾクカンゼンソウブダツリ,ゼンソウキンゾクカンゼンソウブダツリ,16/18,*,ぜ[んそうきんぞくかんぜんそうぶだ]つり
前装金属冠前装部破損,1348,1348,8000,名詞,固有名詞,一般,*,*,*,前装金属冠前装部破損,ゼンソウキンゾクカンゼンソウブハソン,ゼンソウキンゾクカンゼンソウブハソン,16/18,*,ぜ[んそうきんぞくかんぜんそうぶは]そん
前装金属冠前装部不適合,1348,1348,8000,名詞,固有名詞,一般,*,*,*,前装金属冠前装部不適合,ゼンソウキンゾクカンゼンソウブフテキゴウ,ゼンソウキンゾクカンゼンソウブフテキゴウ,0/20,*,ぜ[んそうきんぞくかんぜんそうぶふてきごう
前装金属冠粗造,1348,1348,8000,名詞,固有名詞,一般,*,*,*,前装金属冠粗造,ゼンソウキンゾクカンソゾウ,ゼンソウキンゾクカンソゾウ,11/13,*,ぜ[んそうきんぞくかんそ]ぞう
前装金属冠脱離,1348,1348,8000,名詞,固有名詞,一般,*,*,*,前装金属冠脱離,ゼンソウキンゾクカンダツリ,ゼンソウキンゾクカンダツリ,11/13,*,ぜ[んそうきんぞくかんだ]つり
前装金属冠低位,1348,1348,8000,名詞,固有名詞,一般,*,*,*,前装金属冠低位,ゼンソウキンゾクカンテイイ,ゼンソウキンゾクカンテイイ,11/13,*,ぜ[んそうきんぞくかんて]いい
前装金属冠破損,1348,1348,8000,名詞,固有名詞,一般,*,*,*,前装金属冠破損,ゼンソウキンゾクカンハソン,ゼンソウキンゾクカンハソン,11/13,*,ぜ[んそうきんぞくかんは]そん
前装金属冠不適合,1348,1348,8000,名詞,固有名詞,一般,*,*,*,前装金属冠不適合,ゼンソウキンゾクカンフテキゴウ,ゼンソウキンゾクカンフテキゴウ,13/15,*,ぜ[んそうきんぞくかんふてき]ごう
前装金属ポンティック破損,1348,1348,8000,名詞,固有名詞,一般,*,*,*,前装金属ポンティック破損,ゼンソウキンゾクポンティックハソン,ゼンソウキンゾクポンティックハソン,14/16,*,ぜ[んそうきんぞくぽんてイっくは]そん
前装鋳造冠過高,1348,1348,8000,名詞,固有名詞,一般,*,*,*,前装鋳造冠過高,ゼンソウチュウゾウカンカコウ,ゼンソウチュウゾウカンカコウ,11/13,*,ぜ[んそうちユうぞうかんか]こう
前装鋳造冠前装部脱離,1348,1348,8000,名詞,固有名詞,一般,*,*,*,前装鋳造冠前装部脱離,ゼンソウチュウゾウカンゼンソウブダツリ,ゼンソウチュウゾウカンゼンソウブダツリ,16/18,*,ぜ[んそうちユうぞうかんぜんそうぶだ]つり
前装鋳造冠前装部破損,1348,1348,8000,名詞,固有名詞,一般,*,*,*,前装鋳造冠前装部破損,ゼンソウチュウゾウカンゼンソウブハソン,ゼンソウチュウゾウカンゼンソウブハソン,16/18,*,ぜ[んそうちユうぞうかんぜんそうぶは]そん
前装鋳造冠前装部不適合,1348,1348,8000,名詞,固有名詞,一般,*,*,*,前装鋳造冠前装部不適合,ゼンソウチュウゾウカンゼンソウブフテキゴウ,ゼンソウチュウゾウカンゼンソウブフテキゴウ,18/20,*,ぜ[んそうちユうぞうかんぜんそうぶふてき]ごう
前装鋳造冠粗造,1348,1348,8000,名詞,固有名詞,一般,*,*,*,前装鋳造冠粗造,ゼンソウチュウゾウカンソゾウ,ゼンソウチュウゾウカンソゾウ,11/13,*,ぜ[んそうちユうぞうかんそ]ぞう
前装鋳造冠脱落,1348,1348,8000,名詞,固有名詞,一般,*,*,*,前装鋳造冠脱落,ゼンソウチュウゾウカンダツラク,ゼンソウチュウゾウカンダツラク,12/14,*,ぜ[んそうちユうぞうかんだつ]らく
前装鋳造冠脱離,1348,1348,8000,名詞,固有名詞,一般,*,*,*,前装鋳造冠脱離,ゼンソウチュウゾウカンダツリ,ゼンソウチュウゾウカンダツリ,11/13,*,ぜ[んそうちユうぞうかんだ]つり
前装鋳造冠低位,1348,1348,8000,名詞,固有名詞,一般,*,*,*,前装鋳造冠低位,ゼンソウチュウゾウカンテイイ,ゼンソウチュウゾウカンテイイ,11/13,*,ぜ[んそうちユうぞうかんて]いい
前装鋳造冠破損,1348,1348,8000,名詞,固有名詞,一般,*,*,*,前装鋳造冠破損,ゼンソウチュウゾウカンハソン,ゼンソウチュウゾウカンハソン,11/13,*,ぜ[んそうちユうぞうかんは]そん
前装鋳造冠不適合,1348,1348,8000,名詞,固有名詞,一般,*,*,*,前装鋳造冠不適合,ゼンソウチュウゾウカンフテキゴウ,ゼンソウチュウゾウカンフテキゴウ,13/15,*,ぜ[んそうちユうぞうかんふてき]ごう
前装鋳造ポンティック破損,1348,1348,8000,名詞,固有名詞,一般,*,*,*,前装鋳造ポンティック破損,ゼンソウチュウゾウポンティックハソン,ゼンソウチュウゾウポンティックハソン,14/16,*,ぜ[んそうちユうぞうぽんてイっくは]そん
前頭位のための母体管理,1348,1348,8000,名詞,固有名詞,一般,*,*,*,前頭位のための母体管理,ゼントウイノタメノボタイカンリ,ゼントウイノタメノボタイカンリ,13/15,*,ぜ[んとういのためのぼたいか]んり
前頭洞のう胞,1348,1348,8000,名詞,固有名詞,一般,*,*,*,前頭洞のう胞,ゼントウドウノウホウ,ゼントウドウノウホウ,8/10,*,ぜ[んとうどうのう]ほう
前のう下白内障,1348,1348,8000,名詞,固有名詞,一般,*,*,*,前のう下白内障,ゼンノウカハクナイショウ,ゼンノウカハクナイショウ,9/11,*,ぜ[んのうかはくないし]ヨう
全部金属冠過高,1348,1348,8000,名詞,固有名詞,一般,*,*,*,全部金属冠過高,ゼンブキンゾクカンカコウ,ゼンブキンゾクカンカコウ,10/12,*,ぜ[んぶきんぞくかんか]こう
全部金属冠粗造,1348,1348,8000,名詞,固有名詞,一般,*,*,*,全部金属冠粗造,ゼンブキンゾクカンソゾウ,ゼンブキンゾクカンソゾウ,10/12,*,ぜ[んぶきんぞくかんそ]ぞう
全部金属冠脱離,1348,1348,8000,名詞,固有名詞,一般,*,*,*,全部金属冠脱離,ゼンブキンゾクカンダツリ,ゼンブキンゾクカンダツリ,10/12,*,ぜ[んぶきんぞくかんだ]つり
全部金属冠低位,1348,1348,8000,名詞,固有名詞,一般,*,*,*,全部金属冠低位,ゼンブキンゾクカンテイイ,ゼンブキンゾクカンテイイ,10/12,*,ぜ[んぶきんぞくかんて]いい
全部金属冠破損,1348,1348,8000,名詞,固有名詞,一般,*,*,*,全部金属冠破損,ゼンブキンゾクカンハソン,ゼンブキンゾクカンハソン,10/12,*,ぜ[んぶきんぞくかんは]そん
全部金属冠不適合,1348,1348,8000,名詞,固有名詞,一般,*,*,*,全部金属冠不適合,ゼンブキンゾクカンフテキゴウ,ゼンブキンゾクカンフテキゴウ,12/14,*,ぜ[んぶきんぞくかんふてき]ごう
全部鋳造冠過高,1348,1348,8000,名詞,固有名詞,一般,*,*,*,全部鋳造冠過高,ゼンブチュウゾウカンカコウ,ゼンブチュウゾウカンカコウ,10/12,*,ぜ[んぶちユうぞうかんか]こう
全部鋳造冠粗造,1348,1348,8000,名詞,固有名詞,一般,*,*,*,全部鋳造冠粗造,ゼンブチュウゾウカンソゾウ,ゼンブチュウゾウカンソゾウ,10/12,*,ぜ[んぶちユうぞうかんそ]ぞう
全部鋳造冠脱落,1348,1348,8000,名詞,固有名詞,一般,*,*,*,全部鋳造冠脱落,ゼンブチュウゾウカンダツラク,ゼンブチュウゾウカンダツラク,11/13,*,ぜ[んぶちユうぞうかんだつ]らく
全部鋳造冠脱離,1348,1348,8000,名詞,固有名詞,一般,*,*,*,全部鋳造冠脱離,ゼンブチュウゾウカンダツリ,ゼンブチュウゾウカンダツリ,10/12,*,ぜ[んぶちユうぞうかんだ]つり
全部鋳造冠低位,1348,1348,8000,名詞,固有名詞,一般,*,*,*,全部鋳造冠低位,ゼンブチュウゾウカンテイイ,ゼンブチュウゾウカンテイイ,10/12,*,ぜ[んぶちユうぞうかんて]いい
全部鋳造冠破損,1348,1348,8000,名詞,固有名詞,一般,*,*,*,全部鋳造冠破損,ゼンブチュウゾウカンハソン,ゼンブチュウゾウカンハソン,10/12,*,ぜ[んぶちユうぞうかんは]そん
全部鋳造冠不適合,1348,1348,8000,名詞,固有名詞,一般,*,*,*,全部鋳造冠不適合,ゼンブチュウゾウカンフテキゴウ,ゼンブチュウゾウカンフテキゴウ,12/14,*,ぜ[んぶちユうぞうかんふてき]ごう
ゼンブロンＬカプセル,1348,1348,8000,名詞,固有名詞,一般,*,*,*,ゼンブロンＬカプセル,ゼンブロンエルカプセル,ゼンブロンエルカプセル,9/11,*,ぜ[んぶろんえるかぷ]せる
前房のう胞,1348,1348,8000,名詞,固有名詞,一般,*,*,*,前房のう胞,ゼンボウノウホウ,ゼンボウノウホウ,6/8,*,ぜ[んぼうのう]ほう
全癒着胎盤・出血を伴わない,1348,1348,8000,名詞,固有名詞,一般,*,*,*,全癒着胎盤・出血を伴わない,ゼンユチャクタイバン,ゼンユチャクタイバン,0/9,*,ぜ[んゆちヤくたいばん
全癒着胎盤・出血を伴わない,1348,1348,8000,名詞,固有名詞,一般,*,*,*,全癒着胎盤・出血を伴わない,ゼンユチャクタイバンテンシュッケツヲトモナワナイ,ゼンユチャクタイバンテンシュッケツヲトモナワナイ,0/22,*,ぜ[んゆちヤくたいばんてんしユ[っけつをともなわない
前立腺のう胞,1348,1348,8000,名詞,固有名詞,一般,*,*,*,前立腺のう胞,ゼンリツセンノウホウ,ゼンリツセンノウホウ,8/10,*,ぜ[んりつせんのう]ほう
ソアレジン錠,1348,1348,8000,名詞,固有名詞,一般,*,*,*,ソアレジン錠,ソアレジンジョウ,ソアレジンジョウ,7/7,*,そ[あれじん[じ]ヨう
創外固定器加算,1348,1348,8000,名詞,固有名詞,一般,*,*,*,創外固定器加算,ソウガイコテイキカサン,ソウガイコテイキカサン,9/11,*,そ[うがいこていきか]さん
早期退院加算,1348,1348,8000,名詞,固有名詞,一般,*,*,*,早期退院加算,ソウキタイインカサン,ソウキタイインカサン,8/10,*,そ[うきたいいんか]さん
双極性感情障害・中等症のうつ病エピソード,1348,1348,8000,名詞,固有名詞,一般,*,*,*,双極性感情障害・中等症のうつ病エピソード,ソウキョクセイカンジョウショウガイ,ソウキョクセイカンジョウショウガイ,1/14,*,そ]うきヨ[くせいかんじヨうしヨうがい
双極性感情障害・混合性エピソード,1348,1348,8000,名詞,固有名詞,一般,*,*,*,双極性感情障害・混合性エピソード,ソウキョクセイカンジョウショウガイ,ソウキョクセイカンジョウショウガイ,0/14,*,そ[うきヨくせいかんじヨうしヨうがい
双極性感情障害・精神病症状を伴う躁病エピソード,1348,1348,8000,名詞,固有名詞,一般,*,*,*,双極性感情障害・精神病症状を伴う躁病エピソード,ソウキョクセイカンジョウショウガイ,ソウキョクセイカンジョウショウガイ,1/14,*,そ]うきヨ[くせいかんじヨうしヨうがい
双極性感情障害・精神病症状を伴う重症うつ病エピソード,1348,1348,8000,名詞,固有名詞,一般,*,*,*,双極性感情障害・精神病症状を伴う重症うつ病エピソード,ソウキョクセイカンジョウショウガイ,ソウキョクセイカンジョウショウガイ,1/14,*,そ]うきヨ[くせいかんじヨうしヨうがい
双極性感情障害・精神病症状を伴わない躁病エピソード,1348,1348,8000,名詞,固有名詞,一般,*,*,*,双極性感情障害・精神病症状を伴わない躁病エピソード,ソウキョクセイカンジョウショウガイ,ソウキョクセイカンジョウショウガイ,1/14,*,そ]うきヨ[くせいかんじヨうしヨうがい
双極性感情障害・精神病症状を伴わない重症うつ病エピソード,1348,1348,8000,名詞,固有名詞,一般,*,*,*,双極性感情障害・精神病症状を伴わない重症うつ病エピソード,ソウキョクセイカンジョウショウガイ,ソウキョクセイカンジョウショウガイ,1/14,*,そ]うきヨ[くせいかんじヨうしヨうがい
双極性感情障害・軽症のうつ病エピソード,1348,1348,8000,名詞,固有名詞,一般,*,*,*,双極性感情障害・軽症のうつ病エピソード,ソウキョクセイカンジョウショウガイ,ソウキョクセイカンジョウショウガイ,1/14,*,そ]うきヨ[くせいかんじヨうしヨうがい
双極性感情障害・軽躁病エピソード,1348,1348,8000,名詞,固有名詞,一般,*,*,*,双極性感情障害・軽躁病エピソード,ソウキョクセイカンジョウショウガイ,ソウキョクセイカンジョウショウガイ,1/14,*,そ]うきヨ[くせいかんじヨうしヨうがい
双極性感情障害精神病症状,1348,1348,8000,名詞,固有名詞,一般,*,*,*,双極性感情障害精神病症状,ソウキョクセイカンジョウショウガイテンセイシンビョウショウジョウ,ソウキョクセイカンジョウショウガイテンセイシンビョウショウジョウ,1/26,*,そ]うきヨ[くせいかんじヨうしヨうがいてんせいしんびヨうしヨうじ]ヨう
双極性感情障害・精神病症状を伴う重症うつ病エピソード,1348,1348,8000,名詞,固有名詞,一般,*,*,*,双極性感情障害・精神病症状を伴う重症うつ病エピソード,ソウキョクセイカンジョウショウガイテンセイシンビョウショウジョウヲトモナウジュウショウウツビョウ,ソウキョクセイカンジョウショウガイテンセイシンビョウショウジョウヲトモナウジュウショウウツビョウ,1/39,*,そ]うきヨ[くせいかんじヨうしヨうがいてんせいしんびヨうしヨうじヨうをともなうじユうしヨううつびヨう
双極性感情障害精神病症状を伴う重症うつ病,1348,1348,8000,名詞,固有名詞,一般,*,*,*,双極性感情障害精神病症状を伴う重症うつ病,ソウキョクセイカンジョウショウガイテンセイシンビョウショウジョウヲトモナウジュウショウウツビョウ,ソウキョクセイカンジョウショウガイテンセイシンビョウショウジョウヲトモナウジュウショウウツビョウ,1/39,*,そ]うきヨ[くせいかんじヨうしヨうがいてんせいしんびヨうしヨうじヨうをともなうじユうしヨううつび]ヨう
双極性感情障害・精神病症状を伴わない重症うつ病エピソード,1348,1348,8000,名詞,固有名詞,一般,*,*,*,双極性感情障害・精神病症状を伴わない重症うつ病エピソード,ソウキョクセイカンジョウショウガイテンセイシンビョウショウジョウヲトモナワナイジュウショウウツビョウ,ソウキョクセイカンジョウショウガイテンセイシンビョウショウジョウヲトモナワナイジュウショウウツビョウ,1/41,*,そ]うきヨ[くせいかんじヨうしヨうがいてんせいしんびヨうしヨうじヨうをともなわないじユうしヨううつびヨう
双極性感情障害精神病症状がない重症うつ病,1348,1348,8000,名詞,固有名詞,一般,*,*,*,双極性感情障害精神病症状がない重症うつ病,ソウキョクセイカンジョウショウガイテンセイシンビョウショウジョウヲトモナワナイジュウショウウツビョウ,ソウキョクセイカンジョウショウガイテンセイシンビョウショウジョウヲトモナワナイジュウショウウツビョウ,1/41,*,そ]うきヨ[くせいかんじヨうしヨうがいてんせいしんびヨうしヨうじヨうをともなわないじユうしヨううつび]ヨう
総合入院体制加算,1348,1348,8000,名詞,固有名詞,一般,*,*,*,総合入院体制加算,ソウゴウニュウインタイセイカサン,ソウゴウニュウインタイセイカサン,13/15,*,そ[うごうにユういんたいせいか]さん
ソウジュツＭ永大,1348,1348,8000,名詞,固有名詞,一般,*,*,*,ソウジュツＭ永大,ソウジュツエムエイダイ,ソウジュツエムエイダイ,8/10,*,そ[うじユつえむえい]だい
ソウジュツ末,1348,1348,8000,名詞,固有名詞,一般,*,*,*,ソウジュツ末,ソウジュツマツ,ソウジュツマツ,4/6,*,そ[うじユつ]まつ
