紀伊国屋ヤクチＭ,1348,1348,8000,名詞,固有名詞,一般,*,*,*,紀伊国屋ヤクチＭ,キノクニヤヤクチ,キノクニヤヤクチ,6/8,*,き[のくにやや]くち
紀伊国屋ヨクイニン,1348,1348,8000,名詞,固有名詞,一般,*,*,*,紀伊国屋ヨクイニン,キノクニヤヨクイニン,キノクニヤヨクイニン,8/10,*,き[のくにやよくい]にん
紀伊国屋ヨクイニンＭ,1348,1348,8000,名詞,固有名詞,一般,*,*,*,紀伊国屋ヨクイニンＭ,キノクニヤヨクイニン,キノクニヤヨクイニン,8/10,*,き[のくにやよくい]にん
紀伊国屋ヨクイニン末,1348,1348,8000,名詞,固有名詞,一般,*,*,*,紀伊国屋ヨクイニン末,キノクニヤヨクイニンマツ,キノクニヤヨクイニンマツ,10/12,*,き[のくにやよくいにん]まつ
紀伊国屋ヨクイニン末Ｍ,1348,1348,8000,名詞,固有名詞,一般,*,*,*,紀伊国屋ヨクイニン末Ｍ,キノクニヤヨクイニンマツ,キノクニヤヨクイニンマツ,0/12,*,き[のくにやよくいにんまつ
紀伊国屋リュウコツ,1348,1348,8000,名詞,固有名詞,一般,*,*,*,紀伊国屋リュウコツ,キノクニヤリュウコツ,キノクニヤリュウコツ,7/9,*,き[のくにやりユう]こつ
紀伊国屋リュウコツＭ,1348,1348,8000,名詞,固有名詞,一般,*,*,*,紀伊国屋リュウコツＭ,キノクニヤリュウコツ,キノクニヤリュウコツ,7/9,*,き[のくにやりユう]こつ
紀伊国屋リュウタン,1348,1348,8000,名詞,固有名詞,一般,*,*,*,紀伊国屋リュウタン,キノクニヤリュウタン,キノクニヤリュウタン,7/9,*,き[のくにやりユう]たん
紀伊国屋リュウタンＭ,1348,1348,8000,名詞,固有名詞,一般,*,*,*,紀伊国屋リュウタンＭ,キノクニヤリュウタン,キノクニヤリュウタン,7/9,*,き[のくにやりユう]たん
紀伊国屋リュウタン末,1348,1348,8000,名詞,固有名詞,一般,*,*,*,紀伊国屋リュウタン末,キノクニヤリュウタンマツ,キノクニヤリュウタンマツ,9/11,*,き[のくにやりユうたん]まつ
紀伊国屋リュウタン末Ｍ,1348,1348,8000,名詞,固有名詞,一般,*,*,*,紀伊国屋リュウタン末Ｍ,キノクニヤリュウタンマツ,キノクニヤリュウタンマツ,9/11,*,き[のくにやりユうたん]まつ
紀伊国屋レンギョウ,1348,1348,8000,名詞,固有名詞,一般,*,*,*,紀伊国屋レンギョウ,キノクニヤレンギョウ,キノクニヤレンギョウ,7/9,*,き[のくにやれんぎ]ヨう
紀伊国屋レンギョウＭ,1348,1348,8000,名詞,固有名詞,一般,*,*,*,紀伊国屋レンギョウＭ,キノクニヤレンギョウ,キノクニヤレンギョウ,7/9,*,き[のくにやれんぎ]ヨう
キプレス錠,1348,1348,8000,名詞,固有名詞,一般,*,*,*,キプレス錠,キプレスジョウ,キプレスジョウ,4/6,*,き[ぷれすじ]ヨう
キプレスチュアブル錠,1348,1348,8000,名詞,固有名詞,一般,*,*,*,キプレスチュアブル錠,キプレスチュアブルジョウ,キプレスチュアブルジョウ,9/10,*,き[ぷれすちユあぶる[じ]ヨう
基本的検体検査判断料,1348,1348,8000,名詞,固有名詞,一般,*,*,*,基本的検体検査判断料,キホンテキケンタイケンサハンダンリョウ,キホンテキケンタイケンサハンダンリョウ,16/18,*,き[ほんてきけんたいけんさはんだんり]ヨう
キモタブ錠,1348,1348,8000,名詞,固有名詞,一般,*,*,*,キモタブ錠,キモタブジョウ,キモタブジョウ,6/6,*,き[もたぶ[じ]ヨう
キモタブ配合錠,1348,1348,8000,名詞,固有名詞,一般,*,*,*,キモタブ配合錠,キモタブハイゴウジョウ,キモタブハイゴウジョウ,8/10,*,き[もたぶはいごうじ]ヨう
キャルマック錠,1348,1348,8000,名詞,固有名詞,一般,*,*,*,キャルマック錠,キャルマックジョウ,キャルマックジョウ,6/7,*,き[ヤるまっくじ]ヨう
救急医療管理加算,1348,1348,8000,名詞,固有名詞,一般,*,*,*,救急医療管理加算,キュウキュウイリョウカンリカサン,キュウキュウイリョウカンリカサン,11/13,*,き[ユうきユういりヨうかんりか]さん
救急救命管理料,1348,1348,8000,名詞,固有名詞,一般,*,*,*,救急救命管理料,キュウキュウキュウメイカンリリョウ,キュウキュウキュウメイカンリリョウ,12/13,*,き[ユうきユうきユうめいかんりり]ヨう
球形吸着炭カプセル,1348,1348,8000,名詞,固有名詞,一般,*,*,*,球形吸着炭カプセル,キュウケイキュウチャクタンカプセル,キュウケイキュウチャクタンカプセル,12/14,*,き[ユうけいきユうちヤくたんかぷ]せる
球状上顎のう胞,1348,1348,8000,名詞,固有名詞,一般,*,*,*,球状上顎のう胞,キュウジョウジョウガクノウホウ,キュウジョウジョウガクノウホウ,10/12,*,き[ユうじヨうじヨうがくのう]ほう
急性ＨＩＶ感染症候群,1348,1348,8000,名詞,固有名詞,一般,*,*,*,急性ＨＩＶ感染症候群,キュウセイエッチアイブイカンセンショウコウグン,キュウセイエッチアイブイカンセンショウコウグン,5/21,*,き[ユうせいえ]っちあいぶいかんせんしヨうこう]ぐん
急性化膿性胆,1348,1348,8000,名詞,固有名詞,一般,*,*,*,急性化膿性胆,キュウセイカ,キュウセイカ,3/5,*,き[ユうせ]いか
急性化膿性胆のう炎,1348,1348,8000,名詞,固有名詞,一般,*,*,*,急性化膿性胆のう炎,キュウセイカノウセイタンノウエン,キュウセイカノウセイタンノウエン,13/15,*,き[ユうせいかのうせいたんのう]えん
急性気腫性胆のう炎,1348,1348,8000,名詞,固有名詞,一般,*,*,*,急性気腫性胆のう炎,キュウセイキシュセイタンノウエン,キュウセイキシュセイタンノウエン,12/14,*,き[ユうせいきしユせいたんのう]えん
急性期入院対象者入院医学管理料,1348,1348,8000,名詞,固有名詞,一般,*,*,*,急性期入院対象者入院医学管理料,キュウセイキニュウインタイショウシャニュ,キュウセイキニュウインタイショウシャニュ,0/15,*,き[ユうせいきにユういんたいしヨうしヤにユ
急性硬膜下血腫・頭蓋内に達する開放創合併あり,1348,1348,8000,名詞,固有名詞,一般,*,*,*,急性硬膜下血腫・頭蓋内に達する開放創合併あり,キュウセイコウマクカケッシュ,キュウセイコウマクカケッシュ,10/12,*,き[ユうせいこうまくかけ]っしユ
急性硬膜下血腫・頭蓋内に達する開放創合併なし,1348,1348,8000,名詞,固有名詞,一般,*,*,*,急性硬膜下血腫・頭蓋内に達する開放創合併なし,キュウセイコウマクカケッシュ,キュウセイコウマクカケッシュ,10/12,*,き[ユうせいこうまくかけ]っしユ
急性硬膜下血腫・頭蓋内に達する開放創合併あり,1348,1348,8000,名詞,固有名詞,一般,*,*,*,急性硬膜下血腫・頭蓋内に達する開放創合併あり,キュウセイコウマクカケッシュテントウガイナイニタッスルカイホウソウガッペイアリ,キュウセイコウマクカケッシュテントウガイナイニタッスルカイホウソウガッペイアリ,10/37,*,き[ユうせいこうまくかけ]っしユてんとうがいないにた]っするかいほうそうが[っぺい]あり
急性硬膜下血腫・頭蓋内開放創あり,1348,1348,8000,名詞,固有名詞,一般,*,*,*,急性硬膜下血腫・頭蓋内開放創あり,キュウセイコウマクカケッシュテントウガイナイニタッスルカイホウソウガッペイアリ,キュウセイコウマクカケッシュテントウガイナイニタッスルカイホウソウガッペイアリ,10/37,*,き[ユうせいこうまくかけ]っしユてんとうがいないにた]っするかいほうそうが]っぺい]あり
急性硬膜下血腫・頭蓋内に達する開放創合併なし,1348,1348,8000,名詞,固有名詞,一般,*,*,*,急性硬膜下血腫・頭蓋内に達する開放創合併なし,キュウセイコウマクカケッシュテントウガイナイニタッスルカイホウソウガッペイナシ,キュウセイコウマクカケッシュテントウガイナイニタッスルカイホウソウガッペイナシ,10/37,*,き[ユうせいこうまくかけ]っしユてんとうがいないにた]っするかいほうそうが[っぺい]なし
急性硬膜下血腫・頭蓋内開放創なし,1348,1348,8000,名詞,固有名詞,一般,*,*,*,急性硬膜下血腫・頭蓋内開放創なし,キュウセイコウマクカケッシュテントウガイナイニタッスルカイホウソウガッペイナシ,キュウセイコウマクカケッシュテントウガイナイニタッスルカイホウソウガッペイナシ,10/37,*,き[ユうせいこうまくかけ]っしユてんとうがいないにた]っするかいほうそうが]っぺい]なし
急性硬膜外血腫・頭蓋内に達する開放創合併あり,1348,1348,8000,名詞,固有名詞,一般,*,*,*,急性硬膜外血腫・頭蓋内に達する開放創合併あり,キュウセイコウマクガイケッシュ,キュウセイコウマクガイケッシュ,11/13,*,き[ユうせいこうまくがいけ]っしユ
急性硬膜外血腫・頭蓋内に達する開放創合併なし,1348,1348,8000,名詞,固有名詞,一般,*,*,*,急性硬膜外血腫・頭蓋内に達する開放創合併なし,キュウセイコウマクガイケッシュ,キュウセイコウマクガイケッシュ,11/13,*,き[ユうせいこうまくがいけ]っしユ
急性硬膜外血腫・頭蓋内に達する開放創合併あり,1348,1348,8000,名詞,固有名詞,一般,*,*,*,急性硬膜外血腫・頭蓋内に達する開放創合併あり,キュウセイコウマクガイケッシュテントウガイナイニタッスルカイホウソウガッペイアリ,キュウセイコウマクガイケッシュテントウガイナイニタッスルカイホウソウガッペイアリ,11/38,*,き[ユうせいこうまくがいけ]っしユてんとうがいないにた]っするかいほうそうが[っぺいあり
急性硬膜外血腫・頭蓋内開放創あり,1348,1348,8000,名詞,固有名詞,一般,*,*,*,急性硬膜外血腫・頭蓋内開放創あり,キュウセイコウマクガイケッシュテントウガイナイニタッスルカイホウソウガッペイアリ,キュウセイコウマクガイケッシュテントウガイナイニタッスルカイホウソウガッペイアリ,11/38,*,き[ユうせいこうまくがいけ]っしユてんとうがいないにた]っするかいほうそうがっぺい]あり
急性硬膜外血腫・頭蓋内に達する開放創合併なし,1348,1348,8000,名詞,固有名詞,一般,*,*,*,急性硬膜外血腫・頭蓋内に達する開放創合併なし,キュウセイコウマクガイケッシュテントウガイナイニタッスルカイホウソウガッペイナシ,キュウセイコウマクガイケッシュテントウガイナイニタッスルカイホウソウガッペイナシ,11/38,*,き[ユうせいこうまくがいけ]っしユてんとうがいないにた]っするかいほうそうが[っぺいなし
急性硬膜外血腫・頭蓋内開放創なし,1348,1348,8000,名詞,固有名詞,一般,*,*,*,急性硬膜外血腫・頭蓋内開放創なし,キュウセイコウマクガイケッシュテントウガイナイニタッスルカイホウソウガッペイナシ,キュウセイコウマクガイケッシュテントウガイナイニタッスルカイホウソウガッペイナシ,11/38,*,き[ユうせいこうまくがいけ]っしユてんとうがいないにた]っするかいほうそうが]っぺい]なし
急性胆のう炎,1348,1348,8000,名詞,固有名詞,一般,*,*,*,急性胆のう炎,キュウセイタンノウエン,キュウセイタンノウエン,8/10,*,き[ユうせいたんのう]えん
急性薬毒物中毒加算,1348,1348,8000,名詞,固有名詞,一般,*,*,*,急性薬毒物中毒加算,キュウセイヤクドクブツチュウドクカサン,キュウセイヤクドクブツチュウドクカサン,15/17,*,き[ユうせいやくどくぶつちユうどくか]さん
急性涙のう炎,1348,1348,8000,名詞,固有名詞,一般,*,*,*,急性涙のう炎,キュウセイルイノウエン,キュウセイルイノウエン,8/10,*,き[ユうせいるいのう]えん
キュウパップ・,1348,1348,8000,名詞,固有名詞,一般,*,*,*,キュウパップ・,キュウパップ,キュウパップ,3/5,*,き[ユうぱ]っぷ
キュウパップ・Ｍ,1348,1348,8000,名詞,固有名詞,一般,*,*,*,キュウパップ・Ｍ,キュウパップ,キュウパップ,3/5,*,き[ユうぱ]っぷ
救命のための気管内挿管,1348,1348,8000,名詞,固有名詞,一般,*,*,*,救命のための気管内挿管,キュウメイノタメノキカンナイソウカン,キュウメイノタメノキカンナイソウカン,15/17,*,き[ユうめいのためのきかんないそう]かん
キュビシン静注用,1348,1348,8000,名詞,固有名詞,一般,*,*,*,キュビシン静注用,キュビシンジョウチュウヨウ,キュビシンジョウチュウヨウ,8/10,*,き[ユびしんじヨうちユう]よう
胸管損傷・胸腔に達する開放創合併あり,1348,1348,8000,名詞,固有名詞,一般,*,*,*,胸管損傷・胸腔に達する開放創合併あり,キョウカンソンショウ,キョウカンソンショウ,7/8,*,き[ヨうかんそんし]ヨう
胸管損傷・胸腔に達する開放創合併なし,1348,1348,8000,名詞,固有名詞,一般,*,*,*,胸管損傷・胸腔に達する開放創合併なし,キョウカンソンショウ,キョウカンソンショウ,7/8,*,き[ヨうかんそんし]ヨう
胸管損傷・胸腔に達する開放創合併あり,1348,1348,8000,名詞,固有名詞,一般,*,*,*,胸管損傷・胸腔に達する開放創合併あり,キョウカンソンショウテンキョウクウニタッスルカイホウソウガッペイアリ,キョウカンソンショウテンキョウクウニタッスルカイホウソウガッペイアリ,16/31,*,き[ヨうかんそんしヨうてんきヨうくうにた]っするかいほうそうが[っぺい]あり
胸管損傷・胸腔に達する開放創合併なし,1348,1348,8000,名詞,固有名詞,一般,*,*,*,胸管損傷・胸腔に達する開放創合併なし,キョウカンソンショウテンキョウクウニタッスルカイホウソウガッペイナシ,キョウカンソンショウテンキョウクウニタッスルカイホウソウガッペイナシ,16/31,*,き[ヨうかんそんしヨうてんきヨうくうにた]っするかいほうそうが[っぺい]なし
胸管内頸静脈吻合術,1348,1348,8000,名詞,固有名詞,一般,*,*,*,胸管内頸静脈吻合術,キョウカンナイケイジョウミャクフンゴ,キョウカンナイケイジョウミャクフンゴ,12/15,*,き[ヨうかんないけいじヨうみヤくふ]んご
胸腔内血腫・胸腔に達する開放創合併あり,1348,1348,8000,名詞,固有名詞,一般,*,*,*,胸腔内血腫・胸腔に達する開放創合併あり,キョウクウナイケッシュ,キョウクウナイケッシュ,7/9,*,き[ヨうくうないけ]っしユ
胸腔内血腫・胸腔に達する開放創合併なし,1348,1348,8000,名詞,固有名詞,一般,*,*,*,胸腔内血腫・胸腔に達する開放創合併なし,キョウクウナイケッシュ,キョウクウナイケッシュ,7/9,*,き[ヨうくうないけ]っしユ
胸腔内血腫・胸腔に達する開放創合併あり,1348,1348,8000,名詞,固有名詞,一般,*,*,*,胸腔内血腫・胸腔に達する開放創合併あり,キョウクウナイケッシュテンキョウクウニタッスルカイホウソウガッペイアリ,キョウクウナイケッシュテンキョウクウニタッスルカイホウソウガッペイアリ,7/32,*,き[ヨうくうないけ]っしユてんきヨうくうにた]っするかいほうそうが[っぺい]あり
胸腔内血腫・胸腔に達する開放創合併なし,1348,1348,8000,名詞,固有名詞,一般,*,*,*,胸腔内血腫・胸腔に達する開放創合併なし,キョウクウナイケッシュテンキョウクウニタッスルカイホウソウガッペイナシ,キョウクウナイケッシュテンキョウクウニタッスルカイホウソウガッペイナシ,7/32,*,き[ヨうくうないけ]っしユてんきヨうくうにた]っするかいほうそうが[っぺい]なし
胸腔内リンパ節結核・組織学的確認あり,1348,1348,8000,名詞,固有名詞,一般,*,*,*,胸腔内リンパ節結核・組織学的確認あり,キョウクウナイリンパセツケッカク,キョウクウナイリンパセツケッカク,12/15,*,き[ヨうくうないりんぱせつけ]っかく
胸腔内リンパ節結核・菌確認あり,1348,1348,8000,名詞,固有名詞,一般,*,*,*,胸腔内リンパ節結核・菌確認あり,キョウクウナイリンパセツケッカク,キョウクウナイリンパセツケッカク,12/15,*,き[ヨうくうないりんぱせつけ]っかく
胸腔内リンパ節結核・菌確認あり,1348,1348,8000,名詞,固有名詞,一般,*,*,*,胸腔内リンパ節結核・菌確認あり,キョウクウナイリンパセツケッカクテンキンカクニンアリ,キョウクウナイリンパセツケッカクテンキンカクニンアリ,12/25,*,き[ヨうくうないりんぱせつけ]っかくてんきんかくにんあり
胸腔内リンパ節結核・組織学的確認あり,1348,1348,8000,名詞,固有名詞,一般,*,*,*,胸腔内リンパ節結核・組織学的確認あり,キョウクウナイリンパセツケッカクテンソシキガクテキカクニンアリ,キョウクウナイリンパセツケッカクテンソシキガクテキカクニンアリ,12/30,*,き[ヨうくうないりんぱせつけ]っかくてんそしきがくてきかくにんあり
橋梗塞・急性期,1348,1348,8000,名詞,固有名詞,一般,*,*,*,橋梗塞・急性期,キョウコウソクキュウセイキ,キョウコウソクキュウセイキ,9/11,*,き[ヨうこうそくきユうせ]いき
橋梗塞・急性期,1348,1348,8000,名詞,固有名詞,一般,*,*,*,橋梗塞・急性期,キョウコウソクテンキュウセイキ,キョウコウソクテンキュウセイキ,11/13,*,き[ヨうこうそくてんきユうせ]いき
橋梗塞・慢性期,1348,1348,8000,名詞,固有名詞,一般,*,*,*,橋梗塞・慢性期,キョウコウソクテンマンセイキ,キョウコウソクテンマンセイキ,11/13,*,き[ヨうこうそくてんまんせ]いき
橋梗塞・慢性期,1348,1348,8000,名詞,固有名詞,一般,*,*,*,橋梗塞・慢性期,キョウコウソクマンセイキ,キョウコウソクマンセイキ,9/11,*,き[ヨうこうそくまんせ]いき
胸水・腹水濾過濃縮再静注法,1348,1348,8000,名詞,固有名詞,一般,*,*,*,胸水・腹水濾過濃縮再静注法,キョウスイフクスイロカノウシュクサイジ,キョウスイフクスイロカノウシュクサイジ,15/17,*,き[ヨうすいふくすいろかのうしユくさ]いじ
胸腺損傷・胸腔に達する開放創合併あり,1348,1348,8000,名詞,固有名詞,一般,*,*,*,胸腺損傷・胸腔に達する開放創合併あり,キョウセンソンショウ,キョウセンソンショウ,7/8,*,き[ヨうせんそんし]ヨう
胸腺損傷・胸腔に達する開放創合併なし,1348,1348,8000,名詞,固有名詞,一般,*,*,*,胸腺損傷・胸腔に達する開放創合併なし,キョウセンソンショウ,キョウセンソンショウ,7/8,*,き[ヨうせんそんし]ヨう
胸腺損傷・胸腔に達する開放創合併あり,1348,1348,8000,名詞,固有名詞,一般,*,*,*,胸腺損傷・胸腔に達する開放創合併あり,キョウセンソンショウテンキョウクウニタッスルカイホウソウガッペイアリ,キョウセンソンショウテンキョウクウニタッスルカイホウソウガッペイアリ,16/31,*,き[ヨうせんそんしヨうてんきヨうくうにた]っするかいほうそうが[っぺい]あり
胸腺損傷・胸腔に達する開放創合併なし,1348,1348,8000,名詞,固有名詞,一般,*,*,*,胸腺損傷・胸腔に達する開放創合併なし,キョウセンソンショウテンキョウクウニタッスルカイホウソウガッペイナシ,キョウセンソンショウテンキョウクウニタッスルカイホウソウガッペイナシ,16/31,*,き[ヨうせんそんしヨうてんきヨうくうにた]っするかいほうそうが[っぺい]なし
胸腺のう胞,1348,1348,8000,名詞,固有名詞,一般,*,*,*,胸腺のう胞,キョウセンノウホウ,キョウセンノウホウ,6/8,*,き[ヨうせんのう]ほう
キョウニンＭ永大,1348,1348,8000,名詞,固有名詞,一般,*,*,*,キョウニンＭ永大,キョウニンエムエイダイ,キョウニンエムエイダイ,0/10,*,き[ヨ]うにんえむえい]だい
キョウニン水,1348,1348,8000,名詞,固有名詞,一般,*,*,*,キョウニン水,キョウニンスイ,キョウニンスイ,4/6,*,き[ヨうにん]すい
頬粘膜粘液のう胞,1348,1348,8000,名詞,固有名詞,一般,*,*,*,頬粘膜粘液のう胞,キョウネンマクネンエキノウホウ,キョウネンマクネンエキノウホウ,12/14,*,き[ヨうねんまくねんえきのう]ほう
頬粘膜のう胞,1348,1348,8000,名詞,固有名詞,一般,*,*,*,頬粘膜のう胞,キョウネンマクノウホウ,キョウネンマクノウホウ,8/10,*,き[ヨうねんまくのう]ほう
胸部気管損傷・胸腔に達する開放創合併あり,1348,1348,8000,名詞,固有名詞,一般,*,*,*,胸部気管損傷・胸腔に達する開放創合併あり,キョウブキカンソンショウ,キョウブキカンソンショウ,9/10,*,き[ヨうぶきかんそんし]ヨう
胸部気管損傷・胸腔に達する開放創合併なし,1348,1348,8000,名詞,固有名詞,一般,*,*,*,胸部気管損傷・胸腔に達する開放創合併なし,キョウブキカンソンショウ,キョウブキカンソンショウ,9/10,*,き[ヨうぶきかんそんし]ヨう
胸部気管損傷・胸腔に達する開放創合併あり,1348,1348,8000,名詞,固有名詞,一般,*,*,*,胸部気管損傷・胸腔に達する開放創合併あり,キョウブキカンソンショウテンキョウクウニタッスルカイホウソウガッペイアリ,キョウブキカンソンショウテンキョウクウニタッスルカイホウソウガッペイアリ,1/33,*,き]ヨうぶきかんそんしヨうてんきヨうくうにた]っするかいほうそうが[っぺい]あり
胸部気管損傷・胸腔に達する開放創合併なし,1348,1348,8000,名詞,固有名詞,一般,*,*,*,胸部気管損傷・胸腔に達する開放創合併なし,キョウブキカンソンショウテンキョウクウニタッスルカイホウソウガッペイナシ,キョウブキカンソンショウテンキョウクウニタッスルカイホウソウガッペイナシ,1/33,*,き]ヨうぶきかんそんしヨうてんきヨうくうにた]っするかいほうそうが[っぺい]なし
胸部固定帯加算,1348,1348,8000,名詞,固有名詞,一般,*,*,*,胸部固定帯加算,キョウブコテイタイカサン,キョウブコテイタイカサン,1/11,*,き]ヨうぶこていたいか]さん
胸部食道損傷・胸腔に達する開放創合併あり,1348,1348,8000,名詞,固有名詞,一般,*,*,*,胸部食道損傷・胸腔に達する開放創合併あり,キョウブショクドウソンショウ,キョウブショクドウソンショウ,10/11,*,き[ヨうぶしヨくどうそんし]ヨう
胸部食道損傷・胸腔に達する開放創合併なし,1348,1348,8000,名詞,固有名詞,一般,*,*,*,胸部食道損傷・胸腔に達する開放創合併なし,キョウブショクドウソンショウ,キョウブショクドウソンショウ,10/11,*,き[ヨうぶしヨくどうそんし]ヨう
胸部食道損傷・胸腔に達する開放創合併あり,1348,1348,8000,名詞,固有名詞,一般,*,*,*,胸部食道損傷・胸腔に達する開放創合併あり,キョウブショクドウソンショウテンキョウクウニタッスルカイホウソウガッペイアリ,キョウブショクドウソンショウテンキョウクウニタッスルカイホウソウガッペイアリ,1/34,*,き]ヨうぶしヨくどうそんしヨうてんきヨうくうにた]っするかいほうそうが[っぺい]あり
胸部食道損傷・胸腔に達する開放創合併なし,1348,1348,8000,名詞,固有名詞,一般,*,*,*,胸部食道損傷・胸腔に達する開放創合併なし,キョウブショクドウソンショウテンキョウクウニタッスルカイホウソウガッペイナシ,キョウブショクドウソンショウテンキョウクウニタッスルカイホウソウガッペイナシ,1/34,*,き]ヨうぶしヨくどうそんしヨうてんきヨうくうにた]っするかいほうそうが[っぺい]なし
頬部のう腫,1348,1348,8000,名詞,固有名詞,一般,*,*,*,頬部のう腫,キョウブノウシュ,キョウブノウシュ,0/6,*,き[ヨうぶのうしユ
頬部のう胞,1348,1348,8000,名詞,固有名詞,一般,*,*,*,頬部のう胞,キョウブノウホウ,キョウブノウホウ,5/7,*,き[ヨうぶのう]ほう
キョウベリン錠,1348,1348,8000,名詞,固有名詞,一般,*,*,*,キョウベリン錠,キョウベリンジョウ,キョウベリンジョウ,6/7,*,き[ヨうべりん[じ]ヨう
