肺挫傷・胸腔に達する開放創合併なし,1348,1348,8000,名詞,固有名詞,一般,*,*,*,肺挫傷・胸腔に達する開放創合併なし,ハイザショウ,ハイザショウ,3/5,*,は[いざし]ヨう
肺挫傷・胸腔に達する開放創合併あり,1348,1348,8000,名詞,固有名詞,一般,*,*,*,肺挫傷・胸腔に達する開放創合併あり,ハイザショウテンキョウクウニタッスルカイホウソウガッペイアリ,ハイザショウテンキョウクウニタッスルカイホウソウガッペイアリ,13/28,*,は[いざしヨうてんきヨうくうにた]っするかいほうそうが[っぺい]あり
肺挫傷・胸腔に達する開放創合併なし,1348,1348,8000,名詞,固有名詞,一般,*,*,*,肺挫傷・胸腔に達する開放創合併なし,ハイザショウテンキョウクウニタッスルカイホウソウガッペイナシ,ハイザショウテンキョウクウニタッスルカイホウソウガッペイナシ,13/28,*,は[いざしヨうてんきヨうくうにた]っするかいほうそうが[っぺい]なし
ハイシジン錠,1348,1348,8000,名詞,固有名詞,一般,*,*,*,ハイシジン錠,ハイシジンジョウ,ハイシジンジョウ,7/7,*,は[いしじん[じ]ヨう
ハイシジン腟錠,1348,1348,8000,名詞,固有名詞,一般,*,*,*,ハイシジン腟錠,ハイシジンチツジョウ,ハイシジンチツジョウ,7/9,*,は[いしじんちつじ]ヨう
ハイスコ皮下注,1348,1348,8000,名詞,固有名詞,一般,*,*,*,ハイスコ皮下注,ハイスコヒカチュウ,ハイスコヒカチュウ,8/8,*,は[いすこひか[ち]ユう
ハイスタミン注,1348,1348,8000,名詞,固有名詞,一般,*,*,*,ハイスタミン注,ハイスタミンチュウ,ハイスタミンチュウ,8/8,*,は[いすたみん[ち]ユう
ハイスラック錠,1348,1348,8000,名詞,固有名詞,一般,*,*,*,ハイスラック錠,ハイスラックジョウ,ハイスラックジョウ,6/8,*,は[いすらっくじ]ヨう
ハイセチン腟錠,1348,1348,8000,名詞,固有名詞,一般,*,*,*,ハイセチン腟錠,ハイセチンチツジョウ,ハイセチンチツジョウ,7/9,*,は[いせちんちつじ]ヨう
ハイセレニン錠,1348,1348,8000,名詞,固有名詞,一般,*,*,*,ハイセレニン錠,ハイセレニンジョウ,ハイセレニンジョウ,8/8,*,は[いせれにん[じ]ヨう
肺腺様のう胞癌,1348,1348,8000,名詞,固有名詞,一般,*,*,*,肺腺様のう胞癌,ハイセンヨウノウホウガン,ハイセンヨウノウホウガン,10/12,*,は[いせんようのうほう]がん
ハイゼット錠,1348,1348,8000,名詞,固有名詞,一般,*,*,*,ハイゼット錠,ハイゼットジョウ,ハイゼットジョウ,5/7,*,は[いぜっとじ]ヨう
肺損傷・胸腔に達する開放創合併あり,1348,1348,8000,名詞,固有名詞,一般,*,*,*,肺損傷・胸腔に達する開放創合併あり,ハイソンショウ,ハイソンショウ,4/6,*,は[いそんし]ヨう
肺損傷・胸腔に達する開放創合併なし,1348,1348,8000,名詞,固有名詞,一般,*,*,*,肺損傷・胸腔に達する開放創合併なし,ハイソンショウ,ハイソンショウ,4/6,*,は[いそんし]ヨう
肺損傷・胸腔に達する開放創合併あり,1348,1348,8000,名詞,固有名詞,一般,*,*,*,肺損傷・胸腔に達する開放創合併あり,ハイソンショウテンキョウクウニタッスルカイホウソウガッペイアリ,ハイソンショウテンキョウクウニタッスルカイホウソウガッペイアリ,14/29,*,は[いそんしヨうてんきヨうくうにた]っするかいほうそうが[っぺい]あり
肺損傷・胸腔に達する開放創合併なし,1348,1348,8000,名詞,固有名詞,一般,*,*,*,肺損傷・胸腔に達する開放創合併なし,ハイソンショウテンキョウクウニタッスルカイホウソウガッペイナシ,ハイソンショウテンキョウクウニタッスルカイホウソウガッペイナシ,14/29,*,は[いそんしヨうてんきヨうくうにた]っするかいほうそうが[っぺい]なし
ハイチア静注,1348,1348,8000,名詞,固有名詞,一般,*,*,*,ハイチア静注,ハイチアジョウチュウ,ハイチアジョウチュウ,7/8,*,は[いちあじヨうち]ユう
肺提供者名：,1348,1348,8000,名詞,固有名詞,一般,*,*,*,肺提供者名：,ハイテイキョウシャメイ,ハイテイキョウシャメイ,0/9,*,は[いていきヨうしヤめい
ハイトラシン錠,1348,1348,8000,名詞,固有名詞,一般,*,*,*,ハイトラシン錠,ハイトラシンジョウ,ハイトラシンジョウ,6/8,*,は[いとらしんじ]ヨう
ハイドレアカプセル,1348,1348,8000,名詞,固有名詞,一般,*,*,*,ハイドレアカプセル,ハイドレアカプセル,ハイドレアカプセル,7/9,*,は[いどれあかぷ]せる
肺のう胞,1348,1348,8000,名詞,固有名詞,一般,*,*,*,肺のう胞,ハイノウホウ,ハイノウホウ,4/6,*,は[いのう]ほう
肺のう胞症,1348,1348,8000,名詞,固有名詞,一般,*,*,*,肺のう胞症,ハイノウホウショウ,ハイノウホウショウ,6/8,*,は[いのうほうし]ヨう
肺破裂・胸腔に達する開放創合併あり,1348,1348,8000,名詞,固有名詞,一般,*,*,*,肺破裂・胸腔に達する開放創合併あり,ハイハレツ,ハイハレツ,4/5,*,は[いはれ]つ
肺破裂・胸腔に達する開放創合併なし,1348,1348,8000,名詞,固有名詞,一般,*,*,*,肺破裂・胸腔に達する開放創合併なし,ハイハレツ,ハイハレツ,4/5,*,は[いはれ]つ
肺破裂・胸腔に達する開放創合併あり,1348,1348,8000,名詞,固有名詞,一般,*,*,*,肺破裂・胸腔に達する開放創合併あり,ハイハレツテンキョウクウニタッスルカイホウソウガッペイアリ,ハイハレツテンキョウクウニタッスルカイホウソウガッペイアリ,13/28,*,は[いはれつてんきヨうくうにた]っするかいほうそうが[っぺい]あり
肺破裂・胸腔に達する開放創合併なし,1348,1348,8000,名詞,固有名詞,一般,*,*,*,肺破裂・胸腔に達する開放創合併なし,ハイハレツテンキョウクウニタッスルカイホウソウガッペイナシ,ハイハレツテンキョウクウニタッスルカイホウソウガッペイナシ,13/28,*,は[いはれつてんきヨうくうにた]っするかいほうそうが[っぺい]なし
ハイピリドキシン注,1348,1348,8000,名詞,固有名詞,一般,*,*,*,ハイピリドキシン注,ハイピリドキシンチュウ,ハイピリドキシンチュウ,8/10,*,は[いぴりどきしんち]ユう
ハイフィリン注,1348,1348,8000,名詞,固有名詞,一般,*,*,*,ハイフィリン注,ハイフィリンチュウ,ハイフィリンチュウ,6/7,*,は[いふイりんち]ユう
ハイフスタンＭ注,1348,1348,8000,名詞,固有名詞,一般,*,*,*,ハイフスタンＭ注,ハイフスタンエムチュウ,ハイフスタンエムチュウ,8/10,*,は[いふすたんえむち]ユう
ハイフスタン散,1348,1348,8000,名詞,固有名詞,一般,*,*,*,ハイフスタン散,ハイフスタンサン,ハイフスタンサン,7/8,*,は[いふすた[ん]さん
ハイフスタン注,1348,1348,8000,名詞,固有名詞,一般,*,*,*,ハイフスタン注,ハイフスタンチュウ,ハイフスタンチュウ,8/8,*,は[いふすたん[ち]ユう
ハイフル配合顆粒,1348,1348,8000,名詞,固有名詞,一般,*,*,*,ハイフル配合顆粒,ハイフルハイゴウカリュウ,ハイフルハイゴウカリュウ,9/11,*,は[いふるはいごうかり]ユう
ハイ・プレアミンＳ注,1348,1348,8000,名詞,固有名詞,一般,*,*,*,ハイ・プレアミンＳ注,ハイプレアミンエスチュウ,ハイプレアミンエスチュウ,9/11,*,は[いぷれあみんえすち]ユう
ハイ・プレアミン注,1348,1348,8000,名詞,固有名詞,一般,*,*,*,ハイ・プレアミン注,ハイプレアミンチュウ,ハイプレアミンチュウ,7/9,*,は[いぷれあみんち]ユう
ハイペン錠,1348,1348,8000,名詞,固有名詞,一般,*,*,*,ハイペン錠,ハイペンジョウ,ハイペンジョウ,6/6,*,は[いぺん[じ]ヨう
ハイボン錠,1348,1348,8000,名詞,固有名詞,一般,*,*,*,ハイボン錠,ハイボンジョウ,ハイボンジョウ,4/6,*,は[いぼんじ]ヨう
ハイミジン錠,1348,1348,8000,名詞,固有名詞,一般,*,*,*,ハイミジン錠,ハイミジンジョウ,ハイミジンジョウ,5/7,*,は[いみじんじ]ヨう
ハイミタン注,1348,1348,8000,名詞,固有名詞,一般,*,*,*,ハイミタン注,ハイミタンチュウ,ハイミタンチュウ,7/7,*,は[いみたん[ち]ユう
廃用性骨粗鬆症・病的骨折あり,1348,1348,8000,名詞,固有名詞,一般,*,*,*,廃用性骨粗鬆症・病的骨折あり,ハイヨウセイコツソショウショウ,ハイヨウセイコツソショウショウ,0/13,*,は[いようせいこつそしヨうしヨう
廃用性骨粗鬆症・病的骨折あり,1348,1348,8000,名詞,固有名詞,一般,*,*,*,廃用性骨粗鬆症・病的骨折あり,ハイヨウセイコツソショウショウテンビョウテキコッセツアリ,ハイヨウセイコツソショウショウテンビョウテキコッセツアリ,24/25,*,は[いようせいこつそしヨうしヨうてんびヨうてきこ[っせつ]あり
ハイリスク妊産婦紹介加算,1348,1348,8000,名詞,固有名詞,一般,*,*,*,ハイリスク妊産婦紹介加算,ハイリスクニンサンプショウカイカサン,ハイリスクニンサンプショウカイカサン,15/17,*,は[いりすくにんさんぷしヨうかいか]さん
ハイリスク妊娠管理加算,1348,1348,8000,名詞,固有名詞,一般,*,*,*,ハイリスク妊娠管理加算,ハイリスクニンシンカンリカサン,ハイリスクニンシンカンリカサン,13/15,*,は[いりすくにんしんかんりか]さん
ハイリスク分娩管理加算,1348,1348,8000,名詞,固有名詞,一般,*,*,*,ハイリスク分娩管理加算,ハイリスクブンベンカンリカサン,ハイリスクブンベンカンリカサン,13/15,*,は[いりすくぶんべんかんりか]さん
ハウゼマイム注,1348,1348,8000,名詞,固有名詞,一般,*,*,*,ハウゼマイム注,ハウゼマイムチュウ,ハウゼマイムチュウ,6/8,*,は[うぜまいむち]ユう
歯ぎしり防止装置破損,1348,1348,8000,名詞,固有名詞,一般,*,*,*,歯ぎしり防止装置破損,ハギシリボウシソウチハソン,ハギシリボウシソウチハソン,11/13,*,は[ぎしりぼうしそうちは]そん
歯ぎしり防止装置不適合,1348,1348,8000,名詞,固有名詞,一般,*,*,*,歯ぎしり防止装置不適合,ハギシリボウシソウチフテキゴウ,ハギシリボウシソウチフテキゴウ,13/15,*,は[ぎしりぼうしそうちふてき]ごう
橋本病母体より出生した児,1348,1348,8000,名詞,固有名詞,一般,*,*,*,橋本病母体より出生した児,ハシモトビョウボタイヨリシュッセイシタジ,ハシモトビョウボタイヨリシュッセイシタジ,0/18,*,は[しもとびヨうぼたいよりしユっせいしたじ
ハジメ錠,1348,1348,8000,名詞,固有名詞,一般,*,*,*,ハジメ錠,ハジメジョウ,ハジメジョウ,3/5,*,は[じめじ]ヨう
ハタナジン錠,1348,1348,8000,名詞,固有名詞,一般,*,*,*,ハタナジン錠,ハタナジンジョウ,ハタナジンジョウ,7/7,*,は[たなじん[じ]ヨう
八味地黄丸料,1348,1348,8000,名詞,固有名詞,一般,*,*,*,八味地黄丸料,ハチミジオウガンリョウ,ハチミジオウガンリョウ,8/10,*,は[ちみじおうがんり]ヨう
八味地黄丸料エキス顆粒,1348,1348,8000,名詞,固有名詞,一般,*,*,*,八味地黄丸料エキス顆粒,ハチミジオウガンリョウエキスカリュウ,ハチミジオウガンリョウエキスカリュウ,15/16,*,は[ちみじおうがんりヨうえきすかり]ユう
八味地黄丸料エキス顆粒Ｔ,1348,1348,8000,名詞,固有名詞,一般,*,*,*,八味地黄丸料エキス顆粒Ｔ,ハチミジオウガンリョウエキスカリュウ,ハチミジオウガンリョウエキスカリュウ,15/16,*,は[ちみじおうがんりヨうえきすかり]ユう
ハッカ油ＦＭ,1348,1348,8000,名詞,固有名詞,一般,*,*,*,ハッカ油ＦＭ,ハッカユ,ハッカユ,0/4,*,は[っかゆ
ハドドリン錠,1348,1348,8000,名詞,固有名詞,一般,*,*,*,ハドドリン錠,ハドドリンジョウ,ハドドリンジョウ,7/7,*,は[どどりん[じ]ヨう
花扇アキョウ,1348,1348,8000,名詞,固有名詞,一般,*,*,*,花扇アキョウ,ハナオウギアキョウ,ハナオウギアキョウ,6/8,*,は[なおうぎあき]ヨう
花扇アキョウＫ,1348,1348,8000,名詞,固有名詞,一般,*,*,*,花扇アキョウＫ,ハナオウギアキョウ,ハナオウギアキョウ,6/8,*,は[なおうぎあき]ヨう
花扇アセンヤク末,1348,1348,8000,名詞,固有名詞,一般,*,*,*,花扇アセンヤク末,ハナオウギアセンヤクマツ,ハナオウギアセンヤクマツ,10/12,*,は[なおうぎあせんやく]まつ
花扇アセンヤク末Ｋ,1348,1348,8000,名詞,固有名詞,一般,*,*,*,花扇アセンヤク末Ｋ,ハナオウギアセンヤクマツ,ハナオウギアセンヤクマツ,0/12,*,は[なおうぎあせんやくまつ
花扇アマチャ,1348,1348,8000,名詞,固有名詞,一般,*,*,*,花扇アマチャ,ハナオウギアマチャ,ハナオウギアマチャ,7/8,*,は[なおうぎあま]ちヤ
花扇アマチャＫ,1348,1348,8000,名詞,固有名詞,一般,*,*,*,花扇アマチャＫ,ハナオウギアマチャ,ハナオウギアマチャ,7/8,*,は[なおうぎあま]ちヤ
花扇アマチャ末,1348,1348,8000,名詞,固有名詞,一般,*,*,*,花扇アマチャ末,ハナオウギアマチャマツ,ハナオウギアマチャマツ,7/10,*,は[なおうぎあまちヤ]まつ
花扇アマチャ末Ｋ,1348,1348,8000,名詞,固有名詞,一般,*,*,*,花扇アマチャ末Ｋ,ハナオウギアマチャマツ,ハナオウギアマチャマツ,0/10,*,は[なおうぎあまちヤまつ
花扇アロエ末,1348,1348,8000,名詞,固有名詞,一般,*,*,*,花扇アロエ末,ハナオウギアロエマツ,ハナオウギアロエマツ,8/10,*,は[なおうぎあろえ]まつ
花扇アロエ末Ｋ,1348,1348,8000,名詞,固有名詞,一般,*,*,*,花扇アロエ末Ｋ,ハナオウギアロエマツ,ハナオウギアロエマツ,8/10,*,は[なおうぎあろえ]まつ
花扇アンソッコウ,1348,1348,8000,名詞,固有名詞,一般,*,*,*,花扇アンソッコウ,ハナオウギアンソッコウ,ハナオウギアンソッコウ,7/11,*,は[なおうぎあんそ]っこう
花扇アンソッコウＫ,1348,1348,8000,名詞,固有名詞,一般,*,*,*,花扇アンソッコウＫ,ハナオウギアンソッコウ,ハナオウギアンソッコウ,7/11,*,は[なおうぎあんそ]っこう
花扇イレイセン,1348,1348,8000,名詞,固有名詞,一般,*,*,*,花扇イレイセン,ハナオウギイレイセン,ハナオウギイレイセン,8/10,*,は[なおうぎいれい]せん
花扇イレイセンＫ,1348,1348,8000,名詞,固有名詞,一般,*,*,*,花扇イレイセンＫ,ハナオウギイレイセン,ハナオウギイレイセン,8/10,*,は[なおうぎいれい]せん
花扇インチンコウ,1348,1348,8000,名詞,固有名詞,一般,*,*,*,花扇インチンコウ,ハナオウギインチンコウ,ハナオウギインチンコウ,9/11,*,は[なおうぎいんちん]こう
花扇インチンコウＫ,1348,1348,8000,名詞,固有名詞,一般,*,*,*,花扇インチンコウＫ,ハナオウギインチンコウ,ハナオウギインチンコウ,9/11,*,は[なおうぎいんちん]こう
花扇ウイキョウ,1348,1348,8000,名詞,固有名詞,一般,*,*,*,花扇ウイキョウ,ハナオウギウイキョウ,ハナオウギウイキョウ,7/9,*,は[なおうぎういき]ヨう
花扇ウイキョウＫ,1348,1348,8000,名詞,固有名詞,一般,*,*,*,花扇ウイキョウＫ,ハナオウギウイキョウ,ハナオウギウイキョウ,7/9,*,は[なおうぎういき]ヨう
花扇ウバイ,1348,1348,8000,名詞,固有名詞,一般,*,*,*,花扇ウバイ,ハナオウギウバイ,ハナオウギウバイ,6/8,*,は[なおうぎう]ばい
花扇ウバイＫ,1348,1348,8000,名詞,固有名詞,一般,*,*,*,花扇ウバイＫ,ハナオウギウバイ,ハナオウギウバイ,6/8,*,は[なおうぎう]ばい
花扇ウヤク,1348,1348,8000,名詞,固有名詞,一般,*,*,*,花扇ウヤク,ハナオウギウヤク,ハナオウギウヤク,6/8,*,は[なおうぎう]やく
花扇ウヤクＫ,1348,1348,8000,名詞,固有名詞,一般,*,*,*,花扇ウヤクＫ,ハナオウギウヤク,ハナオウギウヤク,6/8,*,は[なおうぎう]やく
花扇ウワウルシ,1348,1348,8000,名詞,固有名詞,一般,*,*,*,花扇ウワウルシ,ハナオウギウワウルシ,ハナオウギウワウルシ,0/10,*,は[なおうぎうわうるし
花扇ウワウルシＫ,1348,1348,8000,名詞,固有名詞,一般,*,*,*,花扇ウワウルシＫ,ハナオウギウワウルシ,ハナオウギウワウルシ,8/10,*,は[なおうぎうわう]るし
花扇エイジツ,1348,1348,8000,名詞,固有名詞,一般,*,*,*,花扇エイジツ,ハナオウギエイジツ,ハナオウギエイジツ,7/9,*,は[なおうぎえい]じつ
花扇エイジツＫ,1348,1348,8000,名詞,固有名詞,一般,*,*,*,花扇エイジツＫ,ハナオウギエイジツ,ハナオウギエイジツ,0/9,*,は[なおうぎえいじつ
花扇エイジツ末,1348,1348,8000,名詞,固有名詞,一般,*,*,*,花扇エイジツ末,ハナオウギエイジツマツ,ハナオウギエイジツマツ,9/11,*,は[なおうぎえいじつ]まつ
花扇エイジツ末Ｋ,1348,1348,8000,名詞,固有名詞,一般,*,*,*,花扇エイジツ末Ｋ,ハナオウギエイジツマツ,ハナオウギエイジツマツ,0/11,*,は[なおうぎえいじつまつ
花扇エンゴサク,1348,1348,8000,名詞,固有名詞,一般,*,*,*,花扇エンゴサク,ハナオウギエンゴサク,ハナオウギエンゴサク,0/10,*,は[なおうぎえんごさく
花扇エンゴサクＫ,1348,1348,8000,名詞,固有名詞,一般,*,*,*,花扇エンゴサクＫ,ハナオウギエンゴサク,ハナオウギエンゴサク,0/10,*,は[なおうぎえんごさく
花扇オウギ,1348,1348,8000,名詞,固有名詞,一般,*,*,*,花扇オウギ,ハナオウギオウギ,ハナオウギオウギ,6/8,*,は[なおうぎお]うぎ
花扇オウギＫ,1348,1348,8000,名詞,固有名詞,一般,*,*,*,花扇オウギＫ,ハナオウギオウギ,ハナオウギオウギ,0/8,*,は[なおうぎおうぎ
花扇オウゴン,1348,1348,8000,名詞,固有名詞,一般,*,*,*,花扇オウゴン,ハナオウギオウゴン,ハナオウギオウゴン,7/9,*,は[なおうぎおう]ごん
花扇オウゴンＫ,1348,1348,8000,名詞,固有名詞,一般,*,*,*,花扇オウゴンＫ,ハナオウギオウゴン,ハナオウギオウゴン,7/9,*,は[なおうぎおう]ごん
花扇オウゴン末,1348,1348,8000,名詞,固有名詞,一般,*,*,*,花扇オウゴン末,ハナオウギオウゴンマツ,ハナオウギオウゴンマツ,9/11,*,は[なおうぎおうごん]まつ
花扇オウゴン末Ｋ,1348,1348,8000,名詞,固有名詞,一般,*,*,*,花扇オウゴン末Ｋ,ハナオウギオウゴンマツ,ハナオウギオウゴンマツ,9/11,*,は[なおうぎおうごん]まつ
花扇オウバク,1348,1348,8000,名詞,固有名詞,一般,*,*,*,花扇オウバク,ハナオウギオウバク,ハナオウギオウバク,7/9,*,は[なおうぎおう]ばく
花扇オウバクＫ,1348,1348,8000,名詞,固有名詞,一般,*,*,*,花扇オウバクＫ,ハナオウギオウバク,ハナオウギオウバク,0/9,*,は[なおうぎおうばく
花扇オウバク末,1348,1348,8000,名詞,固有名詞,一般,*,*,*,花扇オウバク末,ハナオウギオウバクマツ,ハナオウギオウバクマツ,9/11,*,は[なおうぎおうばく]まつ
花扇オウバク末Ｋ,1348,1348,8000,名詞,固有名詞,一般,*,*,*,花扇オウバク末Ｋ,ハナオウギオウバクマツ,ハナオウギオウバクマツ,0/11,*,は[なおうぎおうばくまつ
花扇オウヒ,1348,1348,8000,名詞,固有名詞,一般,*,*,*,花扇オウヒ,ハナオウギオウヒ,ハナオウギオウヒ,6/8,*,は[なおうぎお]うひ
花扇オウヒＫ,1348,1348,8000,名詞,固有名詞,一般,*,*,*,花扇オウヒＫ,ハナオウギオウヒ,ハナオウギオウヒ,0/8,*,は[なおうぎおうひ
花扇オウレン,1348,1348,8000,名詞,固有名詞,一般,*,*,*,花扇オウレン,ハナオウギオウレン,ハナオウギオウレン,7/9,*,は[なおうぎおう]れん
花扇オウレンＫ,1348,1348,8000,名詞,固有名詞,一般,*,*,*,花扇オウレンＫ,ハナオウギオウレン,ハナオウギオウレン,7/9,*,は[なおうぎおう]れん
花扇オウレン末,1348,1348,8000,名詞,固有名詞,一般,*,*,*,花扇オウレン末,ハナオウギオウレンマツ,ハナオウギオウレンマツ,9/11,*,は[なおうぎおうれん]まつ
花扇オウレン末Ｋ,1348,1348,8000,名詞,固有名詞,一般,*,*,*,花扇オウレン末Ｋ,ハナオウギオウレンマツ,ハナオウギオウレンマツ,9/11,*,は[なおうぎおうれん]まつ
花扇オンジ,1348,1348,8000,名詞,固有名詞,一般,*,*,*,花扇オンジ,ハナオウギオンジ,ハナオウギオンジ,6/8,*,は[なおうぎお]んじ
花扇オンジＫ,1348,1348,8000,名詞,固有名詞,一般,*,*,*,花扇オンジＫ,ハナオウギオンジ,ハナオウギオンジ,6/8,*,は[なおうぎお]んじ
花扇オンジ末,1348,1348,8000,名詞,固有名詞,一般,*,*,*,花扇オンジ末,ハナオウギオンジマツ,ハナオウギオンジマツ,8/10,*,は[なおうぎおんじ]まつ
花扇オンジ末Ｋ,1348,1348,8000,名詞,固有名詞,一般,*,*,*,花扇オンジ末Ｋ,ハナオウギオンジマツ,ハナオウギオンジマツ,8/10,*,は[なおうぎおんじ]まつ
花扇加工,1348,1348,8000,名詞,固有名詞,一般,*,*,*,花扇加工,ハナオウギカコウ,ハナオウギカコウ,6/8,*,は[なおうぎか]こう
花扇加工ブシ末,1348,1348,8000,名詞,固有名詞,一般,*,*,*,花扇加工ブシ末,ハナオウギカコウブシマツ,ハナオウギカコウブシマツ,0/12,*,は[なおうぎかこうぶしまつ
花扇加工ブシ末Ｋ,1348,1348,8000,名詞,固有名詞,一般,*,*,*,花扇加工ブシ末Ｋ,ハナオウギカコウブシマツ,ハナオウギカコウブシマツ,0/12,*,は[なおうぎかこうぶしまつ
花扇カゴソウ,1348,1348,8000,名詞,固有名詞,一般,*,*,*,花扇カゴソウ,ハナオウギカゴソウ,ハナオウギカゴソウ,7/9,*,は[なおうぎかご]そう
花扇カゴソウＫ,1348,1348,8000,名詞,固有名詞,一般,*,*,*,花扇カゴソウＫ,ハナオウギカゴソウ,ハナオウギカゴソウ,7/9,*,は[なおうぎかご]そう
花扇カシュウ,1348,1348,8000,名詞,固有名詞,一般,*,*,*,花扇カシュウ,ハナオウギカシュウ,ハナオウギカシュウ,6/8,*,は[なおうぎかし]ユう
花扇カシュウＫ,1348,1348,8000,名詞,固有名詞,一般,*,*,*,花扇カシュウＫ,ハナオウギカシュウ,ハナオウギカシュウ,6/8,*,は[なおうぎかし]ユう
花扇カッコウ,1348,1348,8000,名詞,固有名詞,一般,*,*,*,花扇カッコウ,ハナオウギカッコウ,ハナオウギカッコウ,5/9,*,は[なおうぎか]っこう
花扇カッコウＫ,1348,1348,8000,名詞,固有名詞,一般,*,*,*,花扇カッコウＫ,ハナオウギカッコウ,ハナオウギカッコウ,5/9,*,は[なおうぎか]っこう
花扇カッコン,1348,1348,8000,名詞,固有名詞,一般,*,*,*,花扇カッコン,ハナオウギカッコン,ハナオウギカッコン,5/9,*,は[なおうぎか]っこん
花扇カッコンＫ,1348,1348,8000,名詞,固有名詞,一般,*,*,*,花扇カッコンＫ,ハナオウギカッコン,ハナオウギカッコン,5/9,*,は[なおうぎか]っこん
花扇カッセキ,1348,1348,8000,名詞,固有名詞,一般,*,*,*,花扇カッセキ,ハナオウギカッセキ,ハナオウギカッセキ,5/9,*,は[なおうぎか]っせき
花扇カッセキＫ,1348,1348,8000,名詞,固有名詞,一般,*,*,*,花扇カッセキＫ,ハナオウギカッセキ,ハナオウギカッセキ,5/9,*,は[なおうぎか]っせき
花扇カノコソウ,1348,1348,8000,名詞,固有名詞,一般,*,*,*,花扇カノコソウ,ハナオウギカノコソウ,ハナオウギカノコソウ,8/10,*,は[なおうぎかのこ]そう
花扇カノコソウＫ,1348,1348,8000,名詞,固有名詞,一般,*,*,*,花扇カノコソウＫ,ハナオウギカノコソウ,ハナオウギカノコソウ,8/10,*,は[なおうぎかのこ]そう
花扇カノコソウ末,1348,1348,8000,名詞,固有名詞,一般,*,*,*,花扇カノコソウ末,ハナオウギカノコソウマツ,ハナオウギカノコソウマツ,10/12,*,は[なおうぎかのこそう]まつ
花扇カノコソウ末Ｋ,1348,1348,8000,名詞,固有名詞,一般,*,*,*,花扇カノコソウ末Ｋ,ハナオウギカノコソウマツ,ハナオウギカノコソウマツ,0/12,*,は[なおうぎかのこそうまつ
花扇カロコン,1348,1348,8000,名詞,固有名詞,一般,*,*,*,花扇カロコン,ハナオウギカロコン,ハナオウギカロコン,7/9,*,は[なおうぎかろ]こん
花扇カロコンＫ,1348,1348,8000,名詞,固有名詞,一般,*,*,*,花扇カロコンＫ,ハナオウギカロコン,ハナオウギカロコン,7/9,*,は[なおうぎかろ]こん
花扇カロニン,1348,1348,8000,名詞,固有名詞,一般,*,*,*,花扇カロニン,ハナオウギカロニン,ハナオウギカロニン,7/9,*,は[なおうぎかろ]にん
